{
  "page": "MAIN_DISPLAY",
  "styles": {
    "bg": "#7bc2ce",
    "fontFamily": "system-ui, 'Segoe UI', Roboto, 'Helvetica Neue', Arial, sans-serif",
    "fontWeight": "600",
    "fontSize": "18px"
  },
  "layout": {
    "lcdCanvas": { "width": 240, "height": 320 },
    "rowLeftPadding": 10,
    "labelColumn": { "width": 36 },
    "valueColumn": { "width": 104 },
    "valueBoxLeftPadding": 4,
    "valueBoxRightPadding": 8,
    "valueBoxTextAlign": "right",
    "canvas": { "width": 240, "height": 320 }
  },
  "widgets": [
    {
      "type": "label",
      "text": "<svg width=\"22\" height=\"22\" viewBox=\"0 0 24 24\" fill=\"none\" xmlns=\"http://www.w3.org/2000/svg\" aria-hidden=\"true\"><path d=\"M5 12.55a11 11 0 0 1 14.08 0\" stroke=\"#ffffff\" stroke-width=\"1.8\" stroke-linecap=\"round\"/><path d=\"M1.42 9a16 16 0 0 1 21.16 0\" stroke=\"#ffffff\" stroke-width=\"1.8\" stroke-linecap=\"round\"/><path d=\"M8.53 16.11a6 6 0 0 1 6.95 0\" stroke=\"#ffffff\" stroke-width=\"1.8\" stroke-linecap=\"round\"/><circle cx=\"12\" cy=\"20\" r=\"1.2\" fill=\"#ffffff\"/></svg>",
      "x": 225,
      "y": 8,
      "align": "right",
      "color": "#ffffff"
    },
    {
      "type": "label",
      "text": "<span id=\"temp_val\" style=\"font-size:51px;font-weight:700;line-height:1;letter-spacing:-0.03em\">22.4</span><span style=\"font-size:19px;font-weight:600;vertical-align:super;margin-left:2px\">°C</span>",
      "t3ValueBinding": "IN9",
      "x": 120,
      "y": 34,
      "align": "center",
      "color": "#ffffff"
    },
    {
      "type": "menu_row",
      "id": "main_row_set",
      "label": "STP",
      "value": "15.5",
      "valueId": "stp_val",
      "lcdRow": 4,
      "homeRow": "setpoint",
      "t3ValueBinding": "VAR1",
      "step": 0.5,
      "min": 10,
      "max": 35,
      "notes": "var1: setpoint °C; step/min/max per Tstat10 home screen"
    },
    {
      "type": "menu_row",
      "id": "main_row_fan",
      "label": "FAN",
      "value": "-2",
      "valueId": "fan_val",
      "lcdRow": 5,
      "homeRow": "fan",
      "t3ValueBinding": "VAR2",
      "options": ["-3", "-2", "-1", "0", "1", "2", "3"],
      "notes": "var2: matches MODBUS_FAN_SPEED 0-4 (LCD_TSTAT.h); MSV order OFF..AUTO"
    },
    {
      "type": "menu_row",
      "id": "main_row_sys",
      "label": "SYS",
      "value": "0",
      "valueId": "sys_val",
      "lcdRow": 6,
      "homeRow": "sys",
      "t3ValueBinding": "VAR3",
      "options": ["-2", "-1", "0", "1", "2"],
      "notes": "var3: system mode; default list from tstat10_parameters mode enum"
    },
    {
      "type": "label",
      "id": "main_ticker_line",
      "text": "<div style=\"display:flex;align-items:center;justify-content:flex-start;width:201px;height:23px;box-sizing:border-box;padding:0 9px;border-radius:7px;border:1px solid rgba(255,255,255,0.35);background:rgba(15,55,110,0.55);color:rgba(245,250,255,0.96);font:600 17px 'Fira Mono','Consolas',monospace;letter-spacing:0.03em;\">168.0.151</div>",
      "x": 20,
      "y": 212,
      "align": "left",
      "color": "#ffffff",
      "width": 201
    },
    {
      "type": "label",
      "id": "main_icons_group",
      "text": "<div style=\"display:flex;gap:8px;justify-content:center;align-items:center;width:222px;box-sizing:border-box;padding:0 6px\"><div style=\"width:40px;height:40px;border:1px solid #fff;border-radius:4px;display:flex;align-items:center;justify-content:center;background:rgba(0,0,0,0.1)\" title=\"Day / night\"><svg width=\"36\" height=\"36\" viewBox=\"0 0 48 48\" fill=\"none\" xmlns=\"http://www.w3.org/2000/svg\"><circle cx=\"13\" cy=\"20\" r=\"5\" fill=\"#fff\"/><path d=\"M13 11v2M13 27v2M7 20h2M17 20h2\" stroke=\"#fff\" stroke-width=\"1.3\" stroke-linecap=\"round\"/><circle cx=\"33\" cy=\"20\" r=\"7\" fill=\"#fff\"/><circle cx=\"37\" cy=\"20\" r=\"6.5\" fill=\"#7bc2ce\"/></svg></div><div style=\"width:40px;height:40px;border:1px solid #fff;border-radius:4px;display:flex;align-items:center;justify-content:center;background:rgba(0,0,0,0.1)\" title=\"Occupied / unoccupied\"><svg width=\"36\" height=\"36\" viewBox=\"0 0 48 48\" fill=\"none\" xmlns=\"http://www.w3.org/2000/svg\"><path d=\"M10 28 L24 16 L38 28\" stroke=\"#fff\" stroke-width=\"1.8\" stroke-linejoin=\"round\"/><rect x=\"12\" y=\"28\" width=\"24\" height=\"12\" stroke=\"#fff\" stroke-width=\"1.5\" fill=\"none\"/><path d=\"M20 40v-7h8v7\" stroke=\"#fff\" stroke-width=\"1.2\" fill=\"none\"/><circle cx=\"24\" cy=\"33\" r=\"2.5\" fill=\"#fff\"/><path d=\"M24 35.5v3.5\" stroke=\"#fff\" stroke-width=\"1.3\" stroke-linecap=\"round\"/><path d=\"M21 38h6\" stroke=\"#fff\" stroke-width=\"1.3\" stroke-linecap=\"round\"/></svg></div><div style=\"width:40px;height:40px;border:1px solid #fff;border-radius:4px;display:flex;align-items:center;justify-content:center;background:rgba(0,0,0,0.1)\" title=\"Heat / cool\"><svg width=\"36\" height=\"36\" viewBox=\"0 0 48 48\" fill=\"none\" xmlns=\"http://www.w3.org/2000/svg\"><path d=\"M10 30c-4-8 6-12 6-20 0 8 8 8 4 10-4-2-2-12-2-10z\" fill=\"#fff\"/><line x1=\"23\" y1=\"10\" x2=\"23\" y2=\"38\" stroke=\"#fff\" stroke-width=\"2\" stroke-linecap=\"round\"/><g transform=\"translate(36,24)\" stroke=\"#fff\" stroke-width=\"1.2\" stroke-linecap=\"round\"><line x1=\"0\" y1=\"-9\" x2=\"0\" y2=\"9\"/><line x1=\"-7.8\" y1=\"-4.5\" x2=\"7.8\" y2=\"4.5\"/><line x1=\"-7.8\" y1=\"4.5\" x2=\"7.8\" y2=\"-4.5\"/></g></svg></div><div style=\"width:40px;height:40px;border:1px solid #fff;border-radius:4px;display:flex;align-items:center;justify-content:center;background:rgba(0,0,0,0.1)\" title=\"Fan\"><svg width=\"38\" height=\"38\" viewBox=\"0 0 52 48\" fill=\"none\" xmlns=\"http://www.w3.org/2000/svg\"><g transform=\"translate(14,24)\"><ellipse cx=\"0\" cy=\"-8\" rx=\"4.2\" ry=\"11\" fill=\"#fff\"/><ellipse cx=\"0\" cy=\"-8\" rx=\"4.2\" ry=\"11\" fill=\"#fff\" transform=\"rotate(120)\"/><ellipse cx=\"0\" cy=\"-8\" rx=\"4.2\" ry=\"11\" fill=\"#fff\" transform=\"rotate(240)\"/></g><circle cx=\"14\" cy=\"24\" r=\"2.5\" fill=\"#fff\"/><line x1=\"28\" y1=\"8\" x2=\"28\" y2=\"40\" stroke=\"#fff\" stroke-width=\"2\" stroke-linecap=\"round\"/><rect x=\"31\" y=\"10\" width=\"11\" height=\"8\" rx=\"0.5\" fill=\"none\" stroke=\"#fff\" stroke-width=\"1.2\"/><rect x=\"31\" y=\"19\" width=\"11\" height=\"8\" rx=\"0.5\" fill=\"none\" stroke=\"#fff\" stroke-width=\"1.2\"/><rect x=\"31\" y=\"28\" width=\"11\" height=\"8\" rx=\"0.5\" fill=\"#e8f4ff\" stroke=\"#fff\" stroke-width=\"1.2\"/></svg></div></div>",
      "x": 120,
      "y": 274,
      "align": "center",
      "color": "#ffffff",
      "t3IconBindings": {
        "day_night": "VAR1",
        "occupied": "VAR4",
        "heat_cool": "VAR2",
        "fan": "VAR3"
      },
      "wrap": true,
      "width": 240
    }
  ]
}
