{
  "page": "SETUP_MENU",
  "styles": {
    "bg": "#7bc2ce",
    "highlight": "#39757b",
    "fontFamily": "'Fira Mono', 'Consolas', 'Menlo', 'Monaco', 'Liberation Mono', 'Courier New', monospace",
    "fontWeight": "900",
    "fontSize": "22px"
  },
  "layout": {
    "lcdCanvas": { "width": 240, "height": 320 },
    "lcdTextRows": 10,
    "lcdTextColumns": 16,
    "labelColumnLayout": { "x": 14, "width": 210 },
    "valueColumnLayout": { "x": 224, "width": 0 },
    "menuRowPixelHeight": 32,
    "headerLayout": { "x": 120, "y": 26, "align": "center", "font": "FONT_18_BOLD" },
    "footerLayout": { "x": 0, "y": 272, "width": 240, "height": 48 },
    "footerTopPadding": 4,
    "footerBottomPadding": 8,
    "buttonGap": 4,
    "menuRowLeftPadding": 14
  },
  "widgets": [
    {
      "type": "blank",
      "lcdRow": 1
    },
    {
      "type": "header",
      "text": "Setup Menu",
      "x": 120,
      "y": 26,
      "align": "center",
      "font": "FONT_18_BOLD",
      "lcdRow": 2
    },
    {
      "type": "menu_row",
      "id": "ui_item_ethernet",
      "label": "WiFi Setup",
      "value": "",
      "labelWidth": 180,
      "valueWidth": 24,
      "lcdRow": 3
    },
    {
      "type": "menu_row",
      "id": "ui_item_clock",
      "label": "Clock",
      "value": "",
      "labelWidth": 180,
      "valueWidth": 24,
      "lcdRow": 4
    },
    {
      "type": "menu_row",
      "id": "ui_item_oat",
      "label": "Outside Air Temp",
      "value": "",
      "labelWidth": 180,
      "valueWidth": 24,
      "lcdRow": 5
    },
    {
      "type": "menu_row",
      "id": "ui_item_provisioning",
      "label": "Provisioning",
      "value": "",
      "labelWidth": 180,
      "valueWidth": 24,
      "lcdRow": 6
    },
    {
      "type": "menu_row",
      "id": "ui_item_rs485",
      "label": "RS485 Settings",
      "value": "",
      "labelWidth": 180,
      "valueWidth": 24,
      "lcdRow": 7
    },
    {
      "type": "menu_row",
      "id": "ui_item_tbd",
      "label": "To Be Done",
      "value": "",
      "labelWidth": 180,
      "valueWidth": 24,
      "lcdRow": 8
    },
    {
      "type": "button",
      "id": "btn_back",
      "label": "BACK",
      "width": 68,
      "height": 30,
      "font": "24px 'Fira Mono', 'Consolas', monospace",
      "lcdRow": 9
    },
    {
      "type": "button",
      "id": "btn_down",
      "label": "▼",
      "width": 36,
      "height": 30,
      "font": "28px 'Fira Mono', 'Consolas', monospace",
      "lcdRow": 9
    },
    {
      "type": "button",
      "id": "btn_up",
      "label": "▲",
      "width": 36,
      "height": 30,
      "font": "28px 'Fira Mono', 'Consolas', monospace",
      "lcdRow": 9
    },
    {
      "type": "button",
      "id": "btn_next",
      "label": "NEXT",
      "width": 68,
      "height": 30,
      "font": "24px 'Fira Mono', 'Consolas', monospace",
      "lcdRow": 9
    }
  ]
}
